{
  "sampleId": "student-284857",
  "sourceFile": "samples/Edit&Diagram 3/Edit&Diagram 3/Student-284857.pdf",
  "taskType": "SHORT_ANSWER",
  "grade": "UNKNOWN",
  "reviewStatus": "candidate",
  "reviewerNotes": "AI-generated candidate labels from hermes-gpt-5.6-visual-review using isolated raw-image inference and the full transcription guardrail profile. Human vetting is required before copying this file to ground-truth-vetted/.",
  "errors": [
    {
      "id": "student-284857-e001",
      "written": "friday",
      "intended": "Friday",
      "category": "capitalisation",
      "rationale": "Day of the week should begin with a capital letter. AI confidence: 0.98."
    },
    {
      "id": "student-284857-e002",
      "written": "for a running races.",
      "intended": "for a running race.",
      "category": "morphological",
      "rationale": "Singular determiner 'a' requires singular 'race'. AI confidence: 0.86."
    }
  ]
}
