{
  "sampleId": "student-82935",
  "sourceFile": "samples/Edit&Diagram 3/Edit&Diagram 3/Student-82935.pdf",
  "taskType": "SHORT_ANSWER",
  "grade": "UNKNOWN",
  "reviewStatus": "vetted",
  "reviewerNotes": "Human-vetted expansion label. Blank verdict was accepted as instructed by the reviewer.",
  "errors": [
    {
      "id": "student-82935-e001",
      "written": "at his bed room",
      "intended": "in his bedroom",
      "category": "unsure",
      "rationale": "The location phrase likely needs 'in', and 'bedroom' is normally one word; this combines grammar and orthography. AI confidence: 0.74."
    }
  ]
}
