{
  "sampleId": "student-94156",
  "sourceFile": "samples/Edit&Diagram 3/Edit&Diagram 3/Student-94156.pdf",
  "taskType": "SHORT_ANSWER",
  "grade": "UNKNOWN",
  "reviewStatus": "candidate",
  "reviewerNotes": "AI-generated candidate labels from hermes-gpt-5.6-visual-review using isolated raw-image inference and the full transcription guardrail profile. Human vetting is required before copying this file to ground-truth-vetted/.",
  "errors": [
    {
      "id": "student-94156-e001",
      "written": "because bird has wing.",
      "intended": "because birds have wings.",
      "category": "morphological",
      "rationale": "Plural subject and noun require plural marking and agreement. AI confidence: 0.94."
    },
    {
      "id": "student-94156-e002",
      "written": "at 4:00,",
      "intended": "at 4:00.",
      "category": "punctuation",
      "rationale": "The completed sentence appears to end with a comma rather than a full stop. AI confidence: 0.82."
    }
  ]
}
