{
  "sampleId": "student-121606",
  "sourceFile": "samples/Edit&Diagram 1/Edit&Diagram 1/Student-121606.jpg",
  "taskType": "SHORT_ANSWER",
  "grade": "UNKNOWN",
  "reviewStatus": "candidate",
  "reviewerNotes": "AI-generated candidate labels from hermes-gpt-5.6-visual-review using isolated raw-image inference and the full transcription guardrail profile. Human vetting is required before copying this file to ground-truth-vetted/.",
  "errors": [
    {
      "id": "student-121606-e001",
      "written": "Fox hunt",
      "intended": "Fox hunts",
      "category": "morphological",
      "rationale": "Third-person singular verb likely requires -s. AI confidence: 0.90."
    },
    {
      "id": "student-121606-e002",
      "written": "I am sang",
      "intended": "I sang",
      "category": "morphological",
      "rationale": "The auxiliary 'am' is incompatible with the past-tense form 'sang'. AI confidence: 0.78."
    },
    {
      "id": "student-121606-e003",
      "written": "Pam swimming",
      "intended": "Pam swims",
      "category": "morphological",
      "rationale": "The response appears to use a participle without an auxiliary; exact wording is faint. AI confidence: 0.72."
    },
    {
      "id": "student-121606-e004",
      "written": "Tom Jump",
      "intended": "Tom jumps",
      "category": "morphological",
      "rationale": "Third-person singular verb likely requires -s. AI confidence: 0.86."
    }
  ]
}
